<?xml version="1.0" encoding="ISO-8859-1"?>
<!DOCTYPE peliculas SYSTEM "peli.dtd">
<peliculas>
    <pelicula indice="1">
        <titulo>La La Land</titulo>
        <director>Damien Chazelle</director>
        <anio>2016</anio>
        <duracion>128</duracion>
        <protagonistas>
            <actor nombre="Ryan Gosling">Sebastian Wilder</actor>
            <actor nombre="abc">Mia Dolan</actor>
        </protagonistas>
        <generos>
            <genero>Musical</genero>
            <genero>Comedia</genero>
            <genero>Romance</genero>
        </generos>
        <nacionalidades>
            <nacionalidad>Estados Unidos</nacionalidad>
        </nacionalidades>
    </pelicula>

    <pelicula>
        <titulo>The Shawshank Redemption</titulo>
        <director>Frank Darabont</director>
        <anio>1994</anio>
        <duracion>142</duracion>
        <protagonistas>
            <actor nombre="Tim Robbins"/>
            <actor nombre="Morgan Freeman"/>
        </protagonistas>
        <generos>
            <genero>Drama</genero>
        </generos>
        <nacionalidades>
            <nacionalidad>USA</nacionalidad>
        </nacionalidades>
    </pelicula>

    <pelicula indice="3">
        <titulo>Spirited Away</titulo>
        <director>Hayao Miyazaki</director>
        <anio>2001</anio>
        <duracion>125 minutes</duracion>
        <protagonistas>
            <actor nombre="Rumi Hiiragi"/>
            <actor nombre="Miyu Irino"/>
        </protagonistas>
        <generos>
            <genero>Animation</genero>
            <genero>Adventure</genero>
            <genero>Fantasy</genero>
        </generos>
        <nacionalidades>
            <nacionalidad>Japan</nacionalidad>
        </nacionalidades>
    </pelicula>

</peliculas>